,character,seid,lemmatized,polarity,subjectivity,compound,neg,neu,pos,anger,anticipation,disgust,fear,joy,negative,positive,sadness,surprise,trust,word_count,season,topic,topic_label
2,george,S01E01,be you through yes it be purple I like it I do nt actually recall consider the button on an imaginary microphone uh no not at this time be be you sure this be decaf where s the orange indicator how come you re not doin the second show tomorrow wait a second wait a second what come in what woman be come in no you do nt ha wait wait wait what be she   take the milk can from jerry and put it on the table what be she like smile so you know what what happen oh nothing happen but it be this be great so you know she call and say she want to go out with you tomorrow night god bless devil you whistle disapprovingly ho ho ho have to had to come in have to come in and maybe well get together have to and maybe no no no I hate to tell you this you re not gon na see this woman how do I know maybe you know maybe she want to be polite all right all right I do nt want to tell you this you wanna know why she call you you re a backup you re a secondline a justincase a bplan a contingency claire claire you re a woman right uhm i d like to ask you ask you to analyze a hypothetical phone call you know from a female point of view to claire now a woman call I all right she say she have to come to new york on business   and and maybe shell see I when she get there do this woman intend to spend time with I to be polite I rest my case I m not gon na watch you do laundry come on i m tired panic right I know I feel something jerry I have to tell you something this be the dull moment I ve ever experience I need a break jerry you know I get ta get out of the city I feel so cramped what I ca nt believe fall on his knee we already discuss this cause its signal jerry its signal snap his finger do nt you all right do she even ask you what you be doin tomorrow night if you be busy she call you today and she do nt make a plan for tomorrow what be that its saturday night what be that its ridiculous you do nt even know what hotel she s stay at you ca nt call she that s a signal jerry that s a signal snap his finger signal maybe I m right of course I m right I know I know listen your stuff have to be do by now why do nt you just see if its dry you re gon na overdry it why not to the other laundry patron any question look at that they re do you know I ca nt believe you re bringin in an extra bed for woman that want to sleep with you why do nt you bring in an extra guy too all right all right one more time one more time what be the exact phrasing of the request a decent hotelroom you ca nt be serious this be new york city there must be eleven million decent hotel room whatta you need a flag wave his handkerchief this be the signal jerry this be the signal I think I be affect by the caffeine ho ho ho good dog good dog well that s flattering right can we go cause I m doubleparke I m gon na get a ticket so what that s good because filth be good whaddaya think rock star have sponge and ammonia lyin around the bathroom they have a woman comin over I ve get ta tidy up yeah right in these matter you never do what your instinct tell you always always do the opposite yeah I wish yeah feel awkward its uh not bad its comin along why do you need something well I might be get into that I m aware of you to jerry all right let go open the bathroom door let go what a world that would be if you just could ask a woman what she s thinkin listen listen do nt get work up cause you re gon na know the whole story the minute she step off the plane cause its all in the greeting all right if she put the bag down before she greet you that s a good sign you know anything in the in the lip area be good you know a hug definitely good sure that s so brutal I hate that that s why you know a shake be bad hand sandwich I see well that s open to interpretation because so much depend on the layering and the quality of the wetness in the eye hi how be you laura sure yes the surprise blindfold greeting that be nt in the manual I do nt know what do she look like what actress do she remind you of loni anderson yeah sure I be show a condo on   street besides you think I wanna miss this chuckle yeah I too you come to see I I work in the building I m an architect I m not somewhat annoyed I suppose you could be an architect all right she s not even gon na ask if we see she which be remote be have lunch with a friend he work in the building bert   har   bin   son bert harbinson no good all right uh how about art   cor   velay yeah right he s an importer annoy he s an importerexporter okay beat elaine ever call you back I do nt understand you never talk to she about other woman anxious I forget who I be who be I vandelay let I be the architect I can do it nice to meet you yeah art vandelay   and exporter clear his throat I m uh I m an architect uh railroad uh they can ill just uh get a paper,0.15476863876863878,0.529920153920154,0.9912,0.091,0.774,0.135,9.33510700366403e-06,3.26728745128241e-05,9.33510700366403e-06,1.4936171205862447e-05,1.4936171205862447e-05,2.3337767509160075e-05,2.6138299610259284e-05,1.3069149805129642e-05,1.3069149805129642e-05,1.867021400732806e-05,1035,S01,0,"0: Dating, Relationships, Sex "
567,george,S01E02,from the intercom yeah to jerry ready hey elaine come to the airport with we oh the actresswaitress so just kick she out yeah well a little rough find something good in your pricerange to jerry but you my friend may be in luck no no no this one different this one a beauty I have nt see it yet but its a twobedroom its on the uh west   bout a half block from the park uh twice what you re payin here but its a great building its two bedroom yeah tell I m but quickly I m double park here let not forget the radiator the steam have be on here for ten year no human can turn this off jerry what do you you wanna you wanna see the place or not I do nt know how you put up with this I do nt know there be a fireplace a fireplace that s incredible I do nt know there be a fireplace a garden I ca nt believe there s a garden to elaine you do nt tip a gardener you do nt need a gardener I have plant snort its your decision unenthusiastic congratulation from the intercom yeah its george hey what s goin on frantic oh jerry jerry jerry jerry jerry listen if if you be feel uncomfortable about this at all at all do not feel like you have to take it if you re have second thought if you do nt want it do nt worry about it because uh you know I I I could take it you know no I do nt want it I want it if you do nt want it no I I want it if you do nt want it no I m say if a situation arise in which you do nt want it I might take it how can I take it its your apartment yes but I be not take it I I do nt know who flip you ll flip ill call I m good no catchin flip it head no it hit the table it hit the table interference you ca nt count that come on be you crazy the coin can not touch anything it affect it you do nt have to call that that s a rule oh oh oh all right fine jerry you win take it just take it okay they walk around each other ok ill choose you whaddaya want I want even you get odd right ready mine congratulation congratulation I m just gon na wash george walk to the bathroom scream why do I put up two why do I put up two I love the mirror in that bathroom I do nt know what in the hell it be I look terrific in that mirror george sit I do nt know if its the tile or the lighting   I feel like robert wagner I do nt know I ca nt eat you you ca nt have anything anymore look at this look at this egg out coffee out french fry out blt out I go to visit my grandparent three big brisket sandwich I m sittin here with a carrot they re close in on a hundred I m sayin to they how can you eat that stuff they look at their menu again I m so sick about losin that choose you do nt know what why not oh get outta here I wo nt mope no impossible its your apartment you win the choose well I neither definitely no its not a problem I can get rid of the apartment this afternoon oh its a great place its uh twobedroom uh west   bout half block from the park I do nt know what be doin here this be ridiculous the table be interference you know it it be too hi carol be really glad for you be aware of the proximity to the park yes nice meeting you,0.1502827380952381,0.5434226190476191,0.9805,0.126,0.706,0.168,2.0108990729755275e-05,1.564032612314299e-05,1.340599381983685e-05,2.0108990729755275e-05,2.4577655336367558e-05,3.351498454959212e-05,3.574931685289827e-05,1.7874658426449134e-05,1.1171661516530707e-05,1.340599381983685e-05,669,S01,0,"0: Dating, Relationships, Sex "
838,george,S01E03,I have to say something chuckle I have to say something everything be go so well I have to say something I tell she I like she why why do I tell she I like she I have this sick compulsion to tell woman how I feel I like you I do nt tell you I m outta the picture I be outta the picture laugh its only a matter of time now oh no no no no no ill tell you when it happen when that floss come fly out of my pocket we be in the lobby during the intermission of the play I be buy she one of those container of orange drink for five dollar I reach into my pocket to pay for it I look down there s this piece of green floss hang from my finger of course so I m look at it I look up I see she s look at it our eye lock it be a horrible moment I just if I do nt put that floss in my pocket i d be crawl around her bedroom right now look for my glass yes I be what you do nt like this what do you mean wednesday I though we have ticket to the knick game wednesday we get seat behind the bench what happen be not go oh who be this guy I do nt know why you even bother with this ping pong guy ill tell you that I do nt understand why you spend time with this guy no no no no you have to approach this as if he be a woman absolutely you just tell he the truth   she call I up at my office contd she say we have to talk that or who s bra be this so we order lunch and be talk finally she blurt out how its not work so I m think as she s say this I m think great the relationship over but the egg salad on the way so now I have a decision do I walk or do I eat we sit there for twenty minute chew stare at each other in a defunct relationship have you ever have their egg salad its unbelievable you know what else be unbelievable I pick up the check she do nt even offer she end it the least she could do be send I off with a sandwich its my money what should I do throw it out the window I know a guy who take his vacation on his change sarcastically that s funny you re a funny guy ewing hurt how long be he go to be out geez I get scared there for a second the knick without ewe what about it what not believe he you what no my ticket you give my ticket to horneck why do you give he my ticket for oh cmon jerry I ca nt believe this oh please to the teller can you change this into bill I m not go with he I do nt even know the guy to the teller look they do this for I before you want I to roll six thousand of these what should I quit my job   thirtytwo thirtythree not now nnnnnnngaaa what oh yeah sure keep your money oh geeeee george pantomime stick a knife in his heart and twist it go go he be really cry wait a minute wait a minute as long as you re go to lie to the guy why do nt you tell he that you lose both of the ticket then we can go this be the thing where you go and you have to make your own pizza you know you have to know how to do that you ca nt have people shove their arm into a sixhundre degree oven oh well my money all tie up in change right now trapezoid,0.0004857690202517695,0.6765120415982484,-0.0115,0.074,0.85,0.077,2.2818338642400126e-05,2.966384023512016e-05,1.3691003185440076e-05,1.1409169321200063e-05,1.3691003185440076e-05,3.1945674099360174e-05,2.966384023512016e-05,1.5972837049680087e-05,1.3691003185440076e-05,1.3691003185440076e-05,662,S01,3,"3: Family, Friends, Food"
1080,george,S01E04,I never hear he say anything really funny you would think that but either you re bear with a sense of humor or you re not its not go to change even if you go from the red sun of krypton all the way to the yellow sun of the earth I do nt know but he ai nt funny pardon guy with cat   I do nt know oh no no no no no no i d have to advise against that what do you know this woman a month let see you re go to be with her seventytwo hour that s a date decathlon that s exquisite listen uh if its not too much trouble could you pass I that paper over there up again this be incredible I m I m get it a stock do you ever meet my friend simon he know this guy wilkinson he make a fortune in the stock market now he s get some new thing you know there s suppose to be a big merger he be nt even suppose to say anything you guy should think about do this too I do nt know but simon say that if I want to get involve that wilkinson would tell I the exact right minute to sell you wanna do it its call sendrax they ve get some new kind of technique for televise opera some sort of electronic thingy five thousand   ten ten thousand five thousand cmon wilkinson get million invest in this stock its go up three point since I ve be watch it cmon go for twentyfive hundred well do it together come on come on be in it together that s it gesture to jerry check the raiser ill have the tuna all simon be able to find out be that he s in the hospital of course he s be in touch with he he s leave two message he just have nt hear back yet that s all just give it a little more time all right all right that s it I m gon na go down there to the hospital I m go to find out what s go on all right so what ill start talk to he you know casual and ill work my way around to it maybe he s rest what be you a doctor today I m go today just do nt do anything until you hear from I to the woman boy I have to get to a bathroom fifteen second yeah I mention simon next thing I know I m in the parking lot perhaps they have some sort of a fall out ill tell you one thing I do nt know what he s get but for a sick guy he s very strong laugh not quite I m keep it I m go down with the ship laugh have something else cmon have a little dessert elaine get something its all take care of so do nt finish it I do nt like to discuss figure I do nt know what eight thousand its a hyundai get out of here I tell you not to sell simon make money wilkinson clean up he choose the cat I tell you those trip be relationship killer too bad you ca nt get your buddy superman to fly around the earth at super speed and reverse time you d get all the money back you could have avoid the whole trip to vermont pst move in close with elaine and jerry wilkinson get a bite on a new one petramco corp out of uh springfield I think they re about to introduce some sort of a robot butcher shhhhh if you want to get in there s very little time call to the waitress sweetheart waitress approach and tear off a check george stop she no no no that ought to cover it he hand she some money she turn to leave george stop she just a second just a   let I juspeek   he look at the check then take some money out of her hand george urge jerry and elaine to eat come on come on come on,0.08046965688632356,0.4982166105499439,0.9337,0.091,0.805,0.104,2.428122514968364e-05,2.832809600796424e-05,1.6187483433122424e-05,2.225778972054333e-05,2.832809600796424e-05,2.630466057882394e-05,3.844527315366576e-05,2.0234354291403032e-05,2.225778972054333e-05,2.832809600796424e-05,703,S01,0,"0: Dating, Relationships, Sex "
1309,george,S02E01,she ca nt kill I right people break up all the time it just do nt work out what can I do I want to love she I try to love she I could nt I keep look at her face i d go cmon love her love she oh I have no choice she squeeze it out of I shed tell I she love I all right at first I just look at she i d go oh really or uh boy that s that s something but eventually you have to come back with well I love you you know you can only hold out for so long and I do nt even ask she out she ask I out first she call I up what be I suppose to do say no laugh I ca nt do that to someone I be I m a nice guy and she seduce I we be in my apartment I m sit on the couch she s on the chair I get up to go to the bathroom I come back she s on the couch what be I suppose to do not do anything I could nt do that I would ve insult she I have nothing to do wtih any of this I meet all her friend I do nt want to meet they I keep try to avoid it I know it would only get I in deep but they be everywhere they keep pop up all over the place this be nancy this be susan this be amy this be my cousin this be my brother this be my father   its like I m in quicksand my back be kill I oh yeah everybodys guy be the good please they do nt do anything look do I have to break up with she in person ca nt I do it over the phone ii have no stomach for these thing I m let you in no you wo nt okay please it do nt look good boy boy girl be it that obvious singe imitate tony bennett you know i d go from nod to nothing I think you absolutely have to say something to this guy confront he yes if I be a different person I m outta there I do it its over I tell she in the kitchen   which be risky cause its near all the knife I start with the word listen I say listen marlene and then the next thing I know I m in the middle of it and there s this voice inside of I go you re do it you re do it and then she start to cry and I weaken a bit I almost relent but the voice jerry the voice say keep go keep go you re almost out its like I be make a prison break you know and I m head for the wall and I trip and I twist my ankle and they throw the light on you you know so somehow I get though the crying and I keep run then the cursing start she s fire at I from the guard tower son of a bang son of a boom I get to the top of the wall   the front door I open it up I m one foot away I take one last look around the penitentiary and I jump uh no I I do nt think so oh no thank you no really no no thank except for one small problem hah I leave some book in her apartment oh no no I ca nt go back there jerry its so awkward and you know it could be dangerous sexually something could happen i d be right back where I start from well yeah I do nt know they re book they re my book jerry its not my fault its standard have she leave you one of those message where she use up the whole machine what try to get off the phone just do it like a bandaid one motion right off beat she be sexy though do nt you think yeah to jerry sarcastically yeah doctor I m go to have to wait in that little room all by myself be nt I he pick up a crossword puzzle I well take this I hate the little room george walk into the hallway that lead to the doctor office oh hello doctor I be in there for two minute he do nt do anything touch this feel that   seventyfive buck what s seventyfive buck what be I see sinatra in there be I be entertain I do nt understand this I m only pay half why not oh no no no I pay what I say consider for a second I do nt care no I do nt care absolutely no I do nt know but I do nt I m actually almost happy to hear it I guess I should be but I m not you re a fine person you re a humanitarian she s very sexy I know I know see she tonight see she tomorrow go knock yourself out she s too crazy for I I m okay I m fine I m wonderful I never feel well in my whole life shocked and angry you pay that crook he do nt do anything jerry its a scam who tell you to do that oh I be try to make a point gasp I think I swallow a fly I swallow a fly what do I do he turn to a coffee shop patron at the counter what can happen,0.15355339105339108,0.5329725829725828,0.7676,0.132,0.735,0.133,6.662217785678675e-06,2.1097022987982467e-05,7.77258741662512e-06,1.4434805202303794e-05,1.887628372608958e-05,2.331776224987536e-05,3.5531828190286264e-05,1.332443557135735e-05,1.7765914095143132e-05,1.9986653357036023e-05,949,S02,0,"0: Dating, Relationships, Sex "
1730,george,S02E02,you know I ve be think I can not envision any circumstance in which ill ever have the opportunity to have sex again how s it gon na happen I just do nt see how it could occur they always make I take stock of my life and how I ve pretty much waste all of it and how I plan to continue waste it you know I ca nt believe you re even consider not play we need you you re hit everything to jerry who s go to play left field bender he ca nt play leave he stink I just do nt see what purpose be it gon na serve your go I mean you think dead peole care who s at their funeral they do nt even know they re have a funeral its not like she s hang out in the back go I ca nt believe jerry do nt show up if you re a spirit and you can travel to other dimension and galaxy and find out the mystery of the universe you think she s gon na wanna hang around drexler funeral home on ocean parkway you know how easy it be for dead people to travel its not like get on a bus one second snap his finger its all mental who get pick off in softball its unheard of and then in the fifth inning why do you take off on the pop fly smile what about sharon besser maybe manya miss the funeral because she be off visit another galaxy that day not necessarily,-0.003385416666666672,0.43098958333333337,-0.9703,0.151,0.791,0.058,2.826615410707219e-05,4.2399231160608286e-05,2.826615410707219e-05,2.826615410707219e-05,2.826615410707219e-05,8.479846232121657e-05,7.066538526768047e-05,2.826615410707219e-05,2.826615410707219e-05,4.2399231160608286e-05,266,S02,3,"3: Family, Friends, Food"
1872,george,S02E03,singe master of the housedoling out the charmready with a handshake and an open palmtell a saucy talklove to make a stireveryone appreciate a oh its from le miserable I go to see it last week I ca nt get it out of my head I just keep singe it over and over it just come out I have no control over it I m singin it on elevator bus I m singin it in front of client its take over my life artie schuman from camp hatchapee what be you bud abbott what be you callin I an idiot oh schumann of course really jerry nod his head well what if it do nt stop oh that I really need to hear that help a lot all right just say something just start talk change the subject let just go all right I ca nt believe be have dinner with alton bene yeah hell be look at we like he s backstage at a puppet show singe   master of the housekeeper of the inn   jerry reenter the living room and modestly model his new jacket for george george be impressed this be huge when do this happen can I say one thing to you and I say this with an unblemished record of staunch heterosexuality its fabulous and ill tell you something else I m not even go to ask you I want to know but I m not gon na ask you ll tell I when you feel comfortable so what be it four hundred five hundred do you pay five hundred for this jerry coyly ignore george question while george grow increasingly serious over six ca nt be seven do nt tell I you pay seven hundred dollar for this jacket do you pay seven hundred dollar for this jacket be that what you re say to I you be sick be that what you pay for this jacket over seven hundred what do you pay for this jacket I wo nt say anything I wanna know what you pay for this jacket oh my god a thousand dollar you pay a thousand dollar for this jacket all right fine george head for the door I m walk outta here right now think you pay a thousand dollar for this jacket unless you tell I different jerry remain silent oh ho all right ill tell you what if you do nt say anything in the next five second ill know it be over a thousand well I m go with he i d like to   I ve never do a solid before singe master of the housequick to catch your eyenever want a passerby to pass he by maybe he do nt show up I do nt think there s ever be an appointment in my life where I want the other guy to show up george notice an elderly man in a leather chair wait a second be that he I m nervous its a great thrill to meet you sir and ill have a club soda with no ice you like ice I say do you like ice do nt you think you get more without it yeah yeah she s punctual   and uh she s be late sometimes I guess   chuckle today she s late yup I know I know that s what they say the weather guy dr waldo no of course not I do nt point at jerry oh he s the comedian no no he s just be modest I just want to tell you that I really enjoy fair game I think it be just brilliant yea well maybe some part the   drivel   part oh my gosh I just realize   I have to make a phone call ii ca nt believe would you thank you for leave I alone with he well let just leave where be she how could she leave we alone with this lunatic ten more minute and that s it I m leave I have to tell you this guy scare I if she do nt show up we ca nt possibly have dinner with he alone well say be frightened and we have to go home I do nt know just start scratch tell he you have the crab he be in the military hell understand that improvise my uh uncle be have an operation I just want to see how he be bone marrow sure guatamala come on let go to hell with elaine be die here contemptuously imitate alton voice he s in the bathroom could nt be well get outta here where do you come up with this stuff singe master of the housedoling out the charmready with a handshake and an open I would nt think so to jerry why do nt you just turn it inside out its uh its only a few block,0.05484632034632034,0.575416305916306,-0.9498,0.13,0.76,0.11,1.2044111558583313e-05,3.9143362565395764e-05,1.505513944822914e-05,2.1077195227520797e-05,3.011027889645828e-05,2.8604764951635366e-05,5.720952990327073e-05,2.709925100681245e-05,7.52756972411457e-06,4.215439045504159e-05,815,S02,0,"0: Dating, Relationships, Sex "
