,character,seid,lemmatized,polarity,subjectivity,compound,neg,neu,pos,anger,anticipation,disgust,fear,joy,negative,positive,sadness,surprise,trust,word_count,season,topic,topic_label
11196,george,S04E01,kramer be on murphy brown be you sure murphy brown the tv show kramer be on murphy brown that son of a gun with candace bergen I ve always like she remember she in carnal knowledge do she show her breast in that I ca nt believe I miss kramer you know he ask I to go with he to california yeah I turn he down he ask I to keep it a secret I know this be like a record my previous record be when joni hirsch ask I not to tell anybody that we sleep together keep a lid on that for about   second I ve mature a free ticket what about accommodation be there a meal allowance what about seat assignment could I have the kosher meal I hear the kosher meal be good and I need clothe get ta get a haircut gon na have to I have to refill my allergy medication oh do I need a hat I need a hat do nt I could we do the universal tour they have that backdraft exhibit now that look very cool to I what I happen to dress base on mood seemingly seemingly but within that basic framework there be many subtle variation only discernable to an acute observer that reflect the many mood the many shade the many side of george costanza this be morning mist personally I m a little nervous about go through these thing I m afraid I m gon na step through into another dimension heh he I make it my bag a knife moisturizer no i uh   I use it cmon jerry let go what be that all about here we go la lala land I get the window seat right I call it what do you mean oh no curly what d you ask I for nope you get your own shampoo conditioner body lotion jerry body ooh a shower cap oh good good come in come in welcome I m george and this be jerry over there on the phone that s jerry and you be um lupe that s very nice very nice listen be you go to be make up the bed in the morning fine excellent could you do I a favor could you not tuck the blanket in cause I ca nt sleep all tuck in yes I like to just be able to take the blanket and swish they and swirl they you know what I mean you know I do nt like be all tuck in I like to have a lot of room you know I like to have my toe point up in the air just like to scrunch up the blanket exactly you know what I m talk about right uh jerry you want your blanket tuck in you want your blanket tuck in when lupe make up the bed in the morning alright so that s one tuck and one notuck yeah one second sweetheart jerry I really think it d be easy if you do nt tuck you just say you be nt tuck alrighty so that s one tuck and one notuck get that thank you alright lupe byebye now byebye well what do you want she to do you leave it on the night table hey hey hey its not lupe fault you should nt have leave it out alright now what mood be I in what mood be I in you should nt have tuck nobody tuck anymore this be very exciting you re on the tonight show nbc who else be on the show might meet a celebrity what be you worried about you know it yeah yeah yeah yeah go go about your business ill just wander around go go go do nt worry about it hey point at he corbin bernsen big fan big fan hey you grow a beard huh hey you know do I have a case for you guy to do on la law   so mind you at this point I m only go out with her two or three week so she go out of town and she ask I to feed her cat so at this time there s a lot of stuff go on in my life and uh it slip my mind for a few day maybe a week not a week five six day well its the damned thing the cat die so she come back into town she find the cat lie on the carpet stiff as a board that s what she say I say listen it be an old cat it die of natural cause so get this now she tell I that I get ta buy she a brand new cat I say listen honey first of all it be a pretty old cat I m not gon na buy you a brand new cat to replace an old die cat and second of all I go out to the garbage I find you a new cat in fifteen second I say you show I an autopsy report that say this cat die of starvation I spring for a new cat so she say something to I like uh I dunno get the hell out of here and she break up with I now do nt you think that would be a great case on la law I do nt wanna tell you how to run your show but really its enough with the bar already seriously have they though about change the setting really because people do meet in place besides a bar huh what about a rec room huh or a community center yeah fabulous ill think about that george thank you great great I actually just have two meaningful intelligent conversation with corbin bernsen and george wendt yeah yeah not fan talk not gush you know actual conversation I be incredibly articulate what be you crazy you be fine conveyor belt I ca nt believe you re blame lupe,0.19230500240500245,0.5338318422318422,0.9986,0.064,0.768,0.167,8.910670527957229e-06,1.3861043043489024e-05,7.92059602485087e-06,1.4851117546595381e-05,6.930521521744512e-06,2.277171357144625e-05,1.3861043043489024e-05,1.2870968540382663e-05,5.940447018638153e-06,2.3761788074552612e-05,1005,S04,2,"2: Job, Occupation, Ideas"
11485,george,S04E02,he s on the lamb he s on the loose what be we suppose to do what do you do on a situation like this should we call a lawyer should we call the police hope he s not the guy god I m starve I m weak from hunger time like what I m hungry my stomach do nt know that kramer want I could nt have breakfast it be lunchtime the three hour time difference throw I I want a tuna fish sandwich they would nt serve I tuna fish sandwich because they be only serve breakfast for lunch who eat egg for lunch why do nt you say something then I need food jerry I feel faint I m get light head pay phone in la look its a miracle no I do nt have any change I never carry change I have a ten I hate ask for change they always make a face like I m ask they to donate a kidney what breath problem tell I you know I have nt eat anything why do nt you just call of course it be your friend be be accuse of be a serial killer I think that qualify what s the matter with you be you crazy why be you use my name what be I scared of I m scared of the same thing that you be everything why do nt you just use your own name really you think so I do nt know excuse I where be we excuse I ms which street be we on you do nt know how come you do nt know what street be you on black and white why do nt you just say that oh yeah real cool you re a cool guy ill bet you how much you ve get a bet how much do you tip a chamber maid hi how be you guy listen do either one of you have like a mint or piece of gum or jerry would you do I a favor close the window he start it you guy ever shoot anybody hey can I flip on the siren I m just ask all they have to do be say no wohoo check it out you know what I never understand why do they change the siren noise when I be a kid it be always waaaa waaaa you know now it woowoowoowoowoo why do they do that do they do some research do they find that woowoo be more effective than waa you could eat of that shotgun my favorite make the   gauge look like a cap pistol where where where I ca nt see what be you do where do you think you re go hey hey hey be in a rush here what be you do there s a bag of pepperidge farm cookie up there milano should I take some I m starve they re cuff he hi george how you do nothing what do you tip a chamber maid nark no no no you know actually we be friend of a serial killer oh thank you yeah well we do nt think I do nt know why I m do this a player what you re kid somebody else get kill kramer what the hell be you talk about i d like to hear that as a suspect in a serial killing what do they put on this tuna taste like a dill I think its a dill taste this be this a dill tarragon oh you re crazy yeah take care stay in touch no you re crush my sandwich mint I ve get to tell you I m really disappointed in lupe do you think she get to take any of those little bar of soap home you would think that at the end of the week when they hand out the check throw in a few soap ill tell you something if i d own a company my employee would love I they d have huge picture of I up on the wall and in their home like lenin oh my god I forget kramer what be you do here,0.006840945512820504,0.5758613782051283,-0.9352,0.125,0.767,0.108,1.836734693877551e-05,3.061224489795918e-05,1.4285714285714285e-05,3.265306122448979e-05,2.0408163265306123e-05,3.8775510204081634e-05,4.0816326530612245e-05,1.836734693877551e-05,6.122448979591837e-06,2.2448979591836737e-05,700,S04,3,"3: Family, Friends, Food"
11751,george,S04E03,what do they do for toilet paper in the civil war I wonder what toilet paper be loike in the s do they carry it in roll in their duffle bag what all right so what do they do well I think it would be nice if there be some kind of historical record of it uh crespi I m unbelievable at spelling last name give I a last name back off huh all right fine what be that all about for what your own show they want you to do a tv show come on how hard be that look at all the junk that s on tv you want an idea here an idea you coach gymnastic team in high school and you re married and your son not interested in gymnastic and you re push he into gymnastic because you re a gymnastic teacher its only natural I know but he s your son all right forget that idea its not for you okay okay I get it you run an antique store and people come in the store and you get involve in their life why not I know but antique be very popular right now oh yeah like you know really I ca nt believe she get involve with a shrink so what s happen with the tv show you come up with anything why do nt they have salsa on the table salsa be now the number one condiment in america you know it must be impossible for a spanish person to order seltzer and not get salsa angry I want seltzer not salsa see this should be a show this be the show this just talk I m really serious I think that s a good idea its about nothing no forget the story who say you get ta have a story remember when we be wait for for that table in that chinese restaurant that time that could be a tv show I could be a character yeah you could base a character on I yeah there s something wrong with that I m a character people be always say to I you know you re a quite a character elaine could be a character kramer right absolutely nothing we go into nbc scoff writer be talk about a sitcom yeah I think we really go something here an idea an idea for the show its about nothing everybodys do something well do nothing exactly there you go nervous nothing no I m fine I m good I m very good no not nervous I m good very good a beat then he snap I ca nt do this ca nt do this I ca nt do this I ca nt do it I have try I m here its impossible what idea I just say something I do nt know you be go to listen to I they re man with job jerry they wear suit and tie they re married they have secretary I need some water I get ta get some water really that s pretty good who what be that okay okay look you do all the talk okay yeah they re not well than I who be they what about I why they why not I I m as good as they you really think so the parakeet in the mirror that s a good one stu quickly make it up well possibly I write an offbroadway show la cocina actually it be offoffbroadway it be a comedy about a mexican chef pepe no no he mime it that s what be so funny about it interrupting may I I think I can sum up the show for you with one word nothing smile nothing the show be about nothing to jerry no its about nothing attempt to spell his last name dalrimpel be it with a y yeah but nothing happen on the show you see its just like life you know you eat you go shop you read you eat you read you go shop oh no no story show an example what d you do today there s a show that s a show no no no nothing happen because its on tv okay uh look if you want to just keep on do the same old thing then maybe this idea be not for you I for one be not go to compromise my artistic integrity and ill tell you something else this be the show and be not go to change it to jerry right     I think the woman be kind of cute yeah I think I might give she a call I I do nt meet that many woman I meet like three woman a year I mean we ve be introduce she know my name why maybe she like I I I mean she be look right at I you know I think she be impressed you know we have good eye contact the whole meeting wait a minute let I call susan she might be leave to work any minute no oc its george hello oh hello you remember    susan from n b c and this be kramer all right go ahead susan tell he well go ahead tell he and susan the third I never should have bring she up there should have know well should have see it come I do nt see it come you know she be behind the idea she be go to champion the show that s what I be bring she up there to tell you and she like I what be you crazy its a traumatic thing to be throw up on chamberlind you could hold his head in nthe toilet he d still give you half of europe holly wait a second smell it all right,0.17989672977624785,0.5258605851979345,0.9987,0.052,0.783,0.165,4.199140016124698e-06,2.3095270088685837e-05,6.298710024187046e-06,5.248925020155871e-06,1.3647205052405267e-05,2.0995700080623486e-05,3.884204514915345e-05,2.099570008062349e-06,1.1547635044342919e-05,3.779226014512228e-05,976,S04,2,"2: Job, Occupation, Ideas"
12128,george,S04E04,on intercom its george to kramer ah you re just the man I m look for yeah here you go a drycleane bill yeah for vomit on her vest well I should nt have to pay for it to jerry yeah your milk eighteen dollar I do nt know what s yoyo ma all right come on come on let go six dollar I know the show forget about the show we should take the idea to a different network it be a good idea susan like it now if he have nt vomitte all over she we d be write it right now anyway what they wanna have another meeting they wanna buy it they wanna but it oh I tell you be gon na be rich what be we gon na get for this fifty sixty thousand oh its got ta be fifty hee hee you know how much te danson make huh I do nt say be te danson oh yeah do nt worry he can afford it what be that the one your parent give you all right well be a little late I m not take a cab its not the money I do nt shave this morning I do nt feel like myself look at this cause I shave yesterday in the afternoon because of the day before its a long story its not he mister seinfeld what about mister costanza I m not here okay a little the story be the foundation of all entertainment you must have a good story otherwise its just masturbation care forget about care love they have to love the character otherwise why would they keep tune in would they tune in the show will be like a heart attack isis that what I say no story because jerry have to tell I later laugh snort I say I say get outta here no story be that what I say well we would like to be in business let do business well have some business let have business yeah oh oh uh you know its the damnd thing I uh I move recently and my file pfff disappear now ii do nt know if they fall off the truck or if there be some sort of foul play but let I tell you something I m not through with that move company that s my vow to you oh that s good judgment that s a pile of judgment there sure see I tell you I tell you ha ha ha ooh ooh yes how re we gon na do that oh thank you thank gee you know I think you be mad at I when you send I thethe bill for the drycleaning I think the show do nt have a chance anyway ii would like toto pay for the cleaning nonono we all chip in we have the money okay uh eighteen dollar and there it be there you go so maybe we could get together this weekend all right great chuckle bye thank to jerry when susan be far I ca nt believe she take the money I offer to pay she should ve say no maybe this be what the pilot should be about vomit on somebodys vest how much be we gon na get for this fifty sixty thousand oh get ta get fifty get ta get fifty all right I tell you what we go to the coffee shop you call your manager maybe they make an offer excited push jerry forward all right let go let go let go come on thirteen thousand a piece that s insult te danson make eight hundred thousand dollar an episode well he do I m sorry I ca nt live know te danson make that much more than I who be he what about I why he why not I I m well than he crouch too what where where I ca nt go out there he know be friend tell the cop I think you say he be gon na get a muffin I think he be just gon na have a muffin you know a muffin can be very filling I m not sure all right I do nt what s with this guy read the tab jerry yours be eleven dollar muffin sandwich and coffee what s the difference the money be not important ah get outta here the vomiting be much funny no you do,0.20909090909090908,0.5791291291291291,0.9984,0.057,0.769,0.174,1.4298378563870856e-05,2.6809459807257858e-05,1.0723783922903144e-05,1.6085675884354712e-05,3.0384054448225573e-05,1.9660270525322427e-05,4.1107838371128716e-05,1.4298378563870856e-05,1.9660270525322427e-05,3.7533243730161e-05,748,S04,2,"2: Job, Occupation, Ideas"
12481,george,S04E05,so I m uh I m afraid be go to have to pass well its     much too low tsh snort ah yeah we ve   we ve talk     I believe I can speak for the both of we on this standard be te danson deal standard you know the guy from cheer I do nt say I be te danson you tell russell oh   do I have to write he a note or something well what would I say in the note ohohf snort yeah I m a writer laugh whais that the one your parent give you ahhhhh exhale jerry my young friend you re so nave you be so so nave you know about a few thing you know about comedy a little bit about relationship some baseball but you be so far out of your element here you be embarrass yourself now listen to I I m negotiate negotiation this be whatcha do in business ooooo I m scare     ohoooo they re not go to do the show ohooo what be we go to do I m shake I m shake well well just see yes we will I know you do so good for you what be you repeat everything I m say well george     oh hey by the way do you want a box a cuban cigar I smoke one last night I get nauseous here you go yeah cuban yeah the kind that castro smoke you ca nt buy em anywhere yeah yeah I to miss   I miss boy you look really great no no you really look great yeah I see it you almost do the nose what I m not eat bread now I m off bread what do you mean   not let you svenjolly lick a little bit of peanut butter from his finger you know what you should do you should tell this guy you re see somebody else that s the easy way to get out of these thing no you just tell he ah an old boyfriend have come back into your life take a shot,0.13551587301587303,0.4279761904761905,0.9906,0.072,0.744,0.184,1.6610054065725982e-05,4.152513516431496e-05,3.3220108131451964e-05,2.491508109858898e-05,5.8135189230040943e-05,5.8135189230040943e-05,8.305027032862992e-05,4.152513516431496e-05,5.8135189230040943e-05,4.983016219717796e-05,347,S04,2,"2: Job, Occupation, Ideas"
12846,george,S04E06,he say what the hell with they worried oh boy still worry he be pretty emphatic pound get animated look i I uh I have nothing to do with this it be nt my decision it be jerry jerry tell I no I m the creative guy he handle the business end I be quote he why would I be insult I m never insult you could call I baldy dump soup on my head nothing insult I well do nt they make a counter offer how can they just cancel the whole deal like that what kind of a maniac be this guy I mean he just he say no and that s it well he have to play he ca nt just not play be play look I get ta see he how do I get in touch with he mon   no no I ca nt wait til monday that s impossible I get ta talk to he now where do he live gimme the purse costanza costanza the guy who pitch he the show with the story about nothing snap finger jerry seinfeld jerry seinfeld friend into phone frantic mister dalrimple mister dalrimple I have to talk to you its about the show it   no it be   it be all a terrible misunderstanding sir just five minute just five minute of your time listen thank you thank you mister dalrimple sidle in be this a bad time I hope I m not disturb anything enter the apartment more fully oh oh hi hi hi nice to meet you peer at the table what re you have veal look like veal well its a good look piece of meat laugh nervously wow this be some place a duplex huh indicate look at this you get stair in an apartment all my life I dream about have step in an apartment even one step sink living room although one step be really not all that sunken try hard to elicit a laugh no that s a fair question it be uhm   nervous chuckle jerry yeah to cynthia jerry a friend of mine to russell he uh he give it to I unbelievable how many address of people this guy have he s get marlon brando I could go to marlon brando house if I really want course I would nt I mean uh the guy be uh well obviously to cynthia as she pass the guy have his problem well you know its really very funny because you know what we get here really we really really just have a terrible misunderstanding you see when I pass on the deal I think that s what jerry want I to say yknow I I misinterpret oh what time be it eight thirty ill tell you what s on you get major dad blossom very funny programme be you sure oh look who I m talk to the president of nbc force laughter worried alright alright look be people you and I huh businessman colleague if I may let not quibble well do it for the thirteen thousand thirteen thousand and I never come up here we never talk alright you take good care move past russell toward the door it be nice see you again and nice meeting you to cynthia cynthia right awright lemme just say this ten thousand dollar alright and now I m go below what you want to pay you have your dinner have your veal or whatever it be enjoy alright that s it alright good eight thousand dollar to cynthia cynthia again nice meeting you have I comment on the shoe I love suede its so thick and rich do you ever you ever rub it against the grain alright anyway please you ve make jerry very happy may I just use your bathroom for a moment to jerry hey hey mr seinfeld shake mortys hand hey mr seinfeld how be you what d I do yeah as a matter of fact I do we get a deal uh please morty I m just happy to be work with your talented son   who s not do this for the money you have no idea how refreshing that be big smile eight thousand dollar quietly that s uh for the two of we I be wrong you be right you re smart I m dumb yeah he s something be nt he to jerry you re very special bye mrs seinfeld take care shake hand with morty morty always a pleasure yeah like he be really gon na take your money you re kid man would I like to see the look on his face,0.17573691460055094,0.6515945165945166,0.9971,0.111,0.691,0.198,1.635258796057064e-05,3.270517592114128e-05,1.3082070368456512e-05,1.3082070368456512e-05,3.434043471719834e-05,3.1069917125084214e-05,5.723405786199724e-05,1.962310555268477e-05,2.7799399532970085e-05,3.761095230931247e-05,782,S04,2,"2: Job, Occupation, Ideas"
