,character,seid,lemmatized,polarity,subjectivity,compound,neg,neu,pos,anger,anticipation,disgust,fear,joy,negative,positive,sadness,surprise,trust,word_count,season,topic,topic_label
36611,george,S07E13,through mouthful of food so carrie you and susan be cousin so your baby daughter be gon na be susan second cousin right so what do that make I jokingly well so legally I could marry your daughter negative huho boy ech what else you get aw cmon I m eat here pamela awright I tell you what you look like nice people I m gon na help you out you want a beautiful name soda soda soda soda all name sound strange the first time you hear em what you tell I people love the name blanche the first time they hear it yeah that s right its working I solve problem that s just what I do I think they really go for that soda ah alright believe I that kid gon na be call soda oh no no no course not I get a great name for our kid a real original you wanna hear what it be huh you ready no seven yeah its a beautiful name for a boy or a girl   especially a girl or a boy what you do nt like the name I know its mickey mantle number so not only be it an all around beautiful name it be also a live tribute angry well that s the name yell awright let just stay calm here do nt get all crazy on I adamant yes I be I defy you to come up with a well name than seven alright you have a good time there shout awright already this be a very key issue with I jerry I have this name for a long time christie that s the one you meet in the antique store and you meet she in an antique store I do nt know how you do it the same outfit how many day be it between encounter three day well maybe you catch she on the cusp of a new wash cycle you know she do laundry the day after she meet you everything get clean and she start all over again maybe she move it up in the rotation very curious you know einstein wear the exact same outfit every day pick up his coat awright I m head home stand not yet but she s weaken its mickey mantle jerry my idol mickey incredulous mickey aw cmon its a fantastic name its a real original nobody else be gon na have it and I absolutely love it why not so what re you say disbelief what they re steal the name that s my name I make it up anger well now its not gon na be original its gon na lose all its cachet rage oh its get cachet baby its get cachet up the yinyang hello ken its george costanza I think we need to talk its my name I make it up you ca nt just steal it hey hey hey do nt worry about I I m not a waffler I do nt waffle shout what happen to soda I think we all agree on soda you do nt care for soda shout how dyou not like soda its bubbly its refreshing what about six nine thirt   thirteen no good fourteen shout after ken fourteen to carrie you know the thing be I kinda promise the widow mantle that I would name my baby seven to carrie its just that I know she and boy angry shout so be I to carrie you know you re really be very selfish it would be nice if you would think of someone other than yourself every now and then desperate please I have so little I m family I m have sex with the cousin seven,0.1618400523088023,0.6430758477633477,0.9254,0.096,0.766,0.138,3.062193142728822e-05,3.062193142728822e-05,1.531096571364411e-05,1.531096571364411e-05,2.2966448570466165e-05,3.827741428411028e-05,5.358837999775439e-05,1.531096571364411e-05,2.807010380834754e-05,2.2966448570466165e-05,626,S07,2,"2: Job, Occupation, Ideas"
36987,george,S07E14,hey have you see jerry sit beside elaine I tell he two oclock distracted mm acknowledge katy oh hi oh yeah yeah yeah we meet uh skiing that time you re uh married to the eye guy nose chuckle what s the bad that can happen to a nose what do it get stuff chuckle ahh lady please please chuckle what be that bad ohho yeah curious bald uh love bald laugh wow who uh who be she take aback the actress you re friend with marisa tomei get excited that s that s incredible my cousin vinnie I love she she be fantastic more excitement you be gon na fix I up with she fever pitch marisa tomeis sit home elaine whwhy do nt you tell I that katy be friend with marisa tomei really wow you re quite the good son you gon na sleep on the foldout uh let I ask you something you uh you ever hear of marisa tomei yeah she s uh she s something be nt she well you know katy elaine friend she happen to be very good friend with she uhhmm I do nt know I do nt ask not the point can I finish alright so she say that she could ve fix I up with she well you know if I uh be nt engage coulda fix I up with marisa tomei she say I be just her type get animate yeah yeah you know the odd of I be anyone type I have never be anyone type but apparently this marisa tomei love funny quirky bald man sarcasm huhu like I do nt know that excitement my cousin vinnie I love that I george costanza could be on a date with an oscar winner an oscar winner jerry you know what that s like its like if fifty year ago someone fix I up with katherine hepburn same thing I mean you ve see she right shout marisa tomei I mean she s beautiful right she s just my type the dark hair the full lip oh I love full lip something you can really put the lipstick on downcast yeah too bad too bad listen lemme ask you a question what if I get a cup of coffee with she work up I ca nt have a cup of coffee with a person I m not allow to have coffee frustrate not necessarily shout of course there s something wrong point at jerry we have a pact yeah iii dunno force a laugh hu ha whisper elaine its I george still quiet never mind never mind I need you to do I a favour uhm remember what we be talk about at the coffee shop early still quiet think a second you know your friend be talk about I and you know still quiet the actress shout marisa tomei call to susan uh ah nothing nothing well uhm I think I d like to do it a cup of coffee that that do nt mean anything elaine elaine shout elaine doh oh oh the judge I hate this guy yeah kramer there s a guy out here that pointedly to elaine oh thank very much for yesterday by the way animate fix up a cup of coffee a cup of coffee be not a fix up defensive so what so what if I do work up I m aware I m aware but this be marisa tomei elaine an oscar winner how can I live the rest of my life know I coulda be with marisa tomei she say I be just her type she love short stocky bald funny man yeah what the hell adamant its not cheat if there s no sex frustrated ahh plead elaine cmon would you just make the call indicate the phone please make the call triumph alright impatient what about marisa tomei anyway I be think about what you say about uh I and marisa you know about the uh two of we get together and I know that I say I be engaged but laugh uh you know its really just something you say its like go steady you know uh go steady engage its its all just stuff you say chuckle anyway I be watch uh my cousin vinnie on the uh on the tape the other day and I be think that uh you know the two of we might take a meeting as they say chuckle so what dyou what dyou think urgent move a pinkie if its yes can you move a pinkie laugh it off and try too hard yeah yeah I have a thing for marisa tomei like she would ever go out with a short stocky bald man force laughter hu hu ha ha like that s her type huh she s an oscar winner nervous laughter he heh besides I do nt even know she its not like anyone try to fix we up who who would try and fix I up with marisa tomei not in the last fifteen minute and I love you marisa,0.1041451907467532,0.5382645089285714,0.9995,0.064,0.683,0.253,1.6376976155122717e-05,2.183596820683029e-05,1.3647480129268932e-05,1.3647480129268932e-05,3.548344833609922e-05,1.774172416804961e-05,4.776618045244126e-05,1.5012228142195825e-05,2.3200716219757182e-05,1.2282732116342038e-05,856,S07,0,"0: Dating, Relationships, Sex "
37323,george,S07E15,urgent whisper elaine you have get to get I marisa tomeis phone number yeahhh marisa tomei I just speak to marisa tomei sit opposite elaine and I be nt even that nervous you know I ca nt remember the last time I call a woman without be nervous I usually I m pace all over the room I m hey where you go what you ca nt leave yet we have to discuss my alibi I usually spend saturday afternoon with susan she s gon na want to know what I m do I ca nt use jerry he s in florida yes wait a second wait why be we together because if you ever see she and it come up we have to be in sync hmm okay now why do I have to see point you dismissive its no good what hey hey let not get so defensive here this be a give and take process explain with lot of hand gesture okay look we ve never work together on a lie now you do nt understand how I work I have a certain way of work jerry and I have work together a few time he know how I work its not a personal thing yknow be just try to come up with the good possible lie that s what this be all about alright okay good okay how about this pleased with himself you be have problem with your boyfriend and I be meet you to discuss the situation still pleased she do nt know that we say that you do its good believe I the dentist thing alright the dentist thing be not good after a moment think art vandelay that s your boyfriend he s an importer get irritated he s an importerexporter okay thoughtful yes yes its very complicated wha I do nt tell you I get ta go meet elaine I do nt know sheshe have some problem with this guy she s see yeah yeah she s see this guy art vandelay he s an importerexporter not happy deliver elaine lie well he uh he want to uh quit the export and uh focus just on the importing and its a problem because she think the exporting be as important as the importing try to laugh it off right cmon I m have an affair with elaine if I be have an affair with elaine I would nt tell you I m go to see elaine I would make up some other person to tell you I be gon na go see and then I would go see elaelaine   so anyway if you think about it manure be not really that bad a word I mean its new which be good and a ma in front of it which be also good manewer   right what you think I m do material here modest and I m a little tired well marisa see the thing be   I m sort of engaged I m you know engage hi match long match,0.123001998001998,0.5331598956598956,0.994,0.048,0.784,0.168,1.5500031000062e-05,6.9750139500279e-05,1.5500031000062e-05,2.71250542501085e-05,3.8750077500155e-05,5.03751007502015e-05,6.2000124000248e-05,3.48750697501395e-05,4.26250852501705e-05,4.6500093000186e-05,508,S07,0,"0: Dating, Relationships, Sex "
37581,george,S07E16,you know how hot it get there like   degree your skin be gon na be simmer with boil hey yeah my parent want to come too be that ok uncle leo have regular sex yeah that be odd be nt it I mean they re retire they have no friend yeah they re all through ruin my life what the hell be they still do here lemme see this pamphlet hm all right so ill uh get back to you whew boy its cold outside huh oh these new york winter huh bitter cold bitter you know what the temperature in florida be today eh seventynine that s almost eighty yeah I read someplace the life expectancy in florida be eightyone and in queen seventythree what I ca nt stop by and visit my parent drop pamphlet on coffee table that s where the seinfeld be move they get a great deal yep you know what they get in florida jaialai you bet on the game you clean up what about the dolphin you could swim with the dolphin down there you could pet they they come right out of the water onto the sidewalk rid nah cmon the word be care care I care about your comfort be it here in queen or twelvehundre mile away hey hey how be florida big news ecstatic what you re move to florida that s wonderful I m so happy pause for you I m so happy for you oh what do you need this cold weather for what do you mean so you re move there for spite that s right who the hell be they how dare they oh every chance I get jerry jerry I m bust I m bust my parent be move to florida can you believe it its happen its finally happen i m free del boca vista I know every five year I know I know and you know why they re move there to spite your parent yeah I know they re out of their mind its fantastic beautiful I ca nt believe I do nt push for this soon what what why hey I m sorry you have your buffer zone for many year its my turn to live baby,0.10452468407013861,0.6394697053787963,0.9819,0.096,0.737,0.167,4.899078973153047e-05,6.298815822625346e-05,3.499342123680748e-05,3.499342123680748e-05,5.5989473978891965e-05,8.398421096833795e-05,7.698552672097645e-05,2.7994736989445982e-05,2.7994736989445982e-05,6.998684247361496e-05,378,S07,3,"3: Family, Friends, Food"
37910,george,S07E17,resent the fact nodding I be aware a billiard parlor well that s elaine slide over to make room for she sit down join we please somewhat stern oh the thing cancel sit down confuse what photo mutter out not really want to talk about his family when the costanzas come here one brother stay behind I do nt know what you re get all rile up about there be probably a million costanza really why who yeah try to remember poverotti domingo and uh the other guy hey buddy oh yeah start to open it sally call susan   say you guy really hit it off pretty chintzy huh consider the money she make she s a big executive for federal express no no forget it I do nt want it let just get rid of it I doubt it you know what he s do now he s put a pool table in my old bedroom what s all this mutter to himself as he walk to the bedroom more stuff oh my god what be that stare at the doll this doll pointing look like my mother I know its a doll but it look like my mother what be this thing do here uh I m sorry I ca nt do this I feel like I m in bed with my mother sit on the sofa I m on no sleep bro mutter susan have the doll collection one of the doll look exactly like my mother she like to sleep with it long pause feel like it I tell you this doll be pretty spooky take off his glass rub his eye its freakin I out man and now I get to go back out there and pick up this doormat I do nt susan want to have it out when sally come tomorrow yeah smile susan say you d be excite susan college roommate so call she up and tell she to bring you another one shell be delighted to talk to you you see you see jerry come on if my mother keep shrink this be exactly what she s gon na look like in ten year I try I almost throw it down the incinerator but I could nt do it the guilt be too overwhelming grab the doll open the door to leave susan so attached to this thing hi elaine lose it do nt tell I how to eat try to keep it down because I like this one notice people stare at he he quickly get up collect the his coat and the tiny replica cmon let go let go on his way out he stop in front of a woman block his path oh hi embarrassed about the doll he sheepishly walk out I just want a second opinion to susan I tell you it look like she,0.07883141762452107,0.3993295019157089,0.9797,0.076,0.805,0.118,3.922577045950811e-05,4.79426083393988e-05,8.71683787989069e-06,2.1792094699726726e-05,7.409312197907087e-05,9.152679773885226e-05,6.973470303912553e-05,5.230102727934415e-05,1.743367575978138e-05,4.79426083393988e-05,479,S07,3,"3: Family, Friends, Food"
38205,george,S07E18,joyful june its june highfive hey its junemark michelle be a dog june june june to passerby hey hehah its june june its juuuuune hey hay yes I love juuuuuuuuune june juune baby the catering hall screw up the wedding be delay until june its like a stay of execution point to jerry in joyous agreement hahahah this be my lucky day yeah hey wait a second you know good news for you too susan good friend hallie break up with her boyfriend yeah in motion the wheel be in motion aah hey enthusiastic if this work out forget about it vacation together movie together dinner together itit almost as good as if I do nt get marry the friar club smile ho ho funny be nt he funny funny guy ha ha ha friar hup here we go here we go adamant ah cmon I m tell you I can coach for the nfl its not that hard to jerry oh get outta here to jerry you watch the old video insistent I m tell you look at he look enter last night huh be that something or be that something ah she s great be nt she I tell you you think she could be an it could she be an it clap hand triumphantly we might have an it she s get everything right count on his finger she s intelligent she s smart she s get a great sense of humour well she s smart you take my word for it gleeful hehee wwe could be like the gatsbys do nt they always like you know a bunch of people around and they be all good friend no so tonight she s get ticket for that show she s be work on the fly sando brother great seventhirty alright sure so uh jerry there s an empty apartment in my building if you and hallie want we could try and hold it may what wo nt be a problem mumble aha huh mumble tour be nt that the uh friar club jacket sure sure sure sure patting jerry on the shoulder how about these seat be these fantastic huh huh I feel like lincoln give he the jacket this be very exciting the inner sanctum cheerful alright there you go she s gon na get the jacket back clap hand so let go get some coffee huh really I uh oh break a shoelace today okay brown maybe a black urgent no check quieter please its a little unusual so uh susan and I be think uh dinner at our house saturday night just the four of we worry why not stand cmon what re you talk about you re sour do nt be sour animate what re you kid I we be all get along so well where be all this come from animate what re you talk about she s very concerned she say she be gon na get it back work up because if she get it back then you ll have no reason to be sour you ll desour right aggravate oh that s not good enough you do nt try and desour you have to sweeten too I wanna get it back when we be the gatsbys neither do he yeah well pleased yeah it be the comedian or the manager meekly well its true I see it no i uh wait a minute wait a minute look at that guy right there be nt that the guy from the show heshe wear the jacket motion jerry to follow cmon excuse I the guy be wear a jacket that my friend be if I could talk to the guy for just a sec I tell you he probably go out the back give I m the jacket already what s he yell about they re steal jacket here moose ohh yeahh smile that be really nice this be nice force buoyancy hey you know let call susan well go have coffee moody great now she s sour angry she wo nt sweeten and I m bitter here panicky well leave it here for you,0.2581462585034014,0.5615709246661629,0.9992,0.052,0.705,0.244,6.228770274647245e-06,3.7372621647883466e-05,1.038128379107874e-05,1.4533797307510236e-05,3.9448878406099214e-05,3.529636488966772e-05,6.644021626290393e-05,1.245754054929449e-05,2.6991337856804724e-05,5.19064189553937e-05,694,S07,3,"3: Family, Friends, Food"
38611,george,S07E19,still on the phone all right fine   whatever this friend of susan be stay with we for two week now be I wrong or be that excessive he s a wig master he s with the tour company of joseph and the amazing technicolor dreamcoat he s the guy in charge of the wig leave yeah sure sure   I get to drop my car off at the new lot jiffy park its incredible seventyfive dollar a month yeah and you get this really cool tshirt when you sign on good good day not too convincing you very nice grab the phone quick get it get it hello yeahyeah ill pick you up right now all right all right hey get ta go so the wig master   the wig master say you could stop by the theater tonight and hell show you around would you pick a station aw great now the volume knob fall off what I want to know how do that get into my car that do nt explain the lipstick on the dashboard be gon na hang around here a little while something funny go on here scuse I do you mind if I ask you a few question oh no nonono I m not a cop   heum   I work for the yankee nevertheless I be wonder if you and your friend be do business here at the jiffy park   you know hum what do you people call it turn trick anyway I I find a condom in my car and I m not say its your but   I want to know if I should just change parking lot ill pay you for your time I just I just need some information   how much do you want ten fifteen you have change for twenty hi honey of course I m tell the truth really well then then you really have something to think about because you know if there s any doubt in your mind   and and it do nt even have to be a big doubt you know even a tiny doubt a dot of a doubt and because if there s any doubt at all I I feel we should cultivate it yes you know deal with it we have to deal with the doubt susan the doubt must be deal with hesitate   nooooooooooo excuse I huh   I think I make a big mistake i d like my deposit back please you get hooker turn trick in my car how s that for starter allright very good i d like my car and my deposit back please whaddaymean well do it say anywhere in the contract about my car be use as a whorehouse cause I do nt remember read that clause either   all right   just give I my car and let I get the hell out of here why what be you talk about I want my car bear with you this be a parking lot people be suppose to be able to get,0.2356063531063531,0.555834990834991,-0.4568,0.115,0.765,0.12,2.4e-05,3.2e-05,1.6e-05,5.2e-05,3.5999999999999994e-05,6.8e-05,8e-05,4.8e-05,3.2e-05,8.400000000000001e-05,500,S07,1,"1: NY Outings, Events"
38949,george,S07E20,I believe the door on the bathroom stall here at the stadium do nt offer much by way of privacy but I be think if we extend the door all the way to the floor   its a calzone sir uh cheese pepperoni eggplant you know a lost and find could be a good idea definitely there put in a lost and find because of I there s a time limit but still yeah I be like a drug dealer I get the guy hook I be have lunch at his desk everyday this week he do nt make a move without I its very exciting so let I ask you a question about the tip jar I have a little thing with the calzone guy this week I go to drop a buck in the tip jar and just as I be about to drop it in he look the other way and then when I be leave he give I this look think thank for nothing I mean if they do nt notice it what s the point not bill beautiful woman you know they could get away with murder you never she any of they lift anything over three pound they get whatever they want whenever they want it you ca nt stop they without thousand of flee japanese you know my last name be costanza that s italian so you and I be like country man pisano and I always take care of my pisano so here be a little something drop in tip and worker look the other way so george decide to take it out and try again only to get catch no no that s not what I be try to do I get your calzone mr steinbrenner I think tomorrow maybe we d try a little corn beef how about chinese I just think it would be nice a little variety yeah well this be bad I be really in a bad situation now what s he go to do that s exactly the point nobody know what this guy be capable of he fire people like it be a bodily function because before you know it hell be have lunch with he you know how these interoffice politic work what the hell be this there have get to be some way to get back into pisanos yeah you ve hear of it ill see you guy later yeah and since you go buy there everyday I be hope that we could help each other out be you go to help I or not what all right that s a little steep do nt you think all right all right but I have to have they by one oclock he s very regiment about his meal well I be drop of the calzone money for the week   um should nt you be at work by now soooooo you do nt work in the rain your a mailmanneither rain nor sleet nor snow its the first one you be suppose to deliver my calzone we have a deal but I m pay you newman kramer look I need you to do I a favor I need you to get I lunch at pisanos he call in sick can you do it   pm do you need any money what happen where have you be what the hell happen to your shirt your clothe smell just like pisano there s another italian place on jerome maybe I can fool he because they be heat up there,-0.0038416988416988323,0.46108429858429867,-0.973,0.137,0.753,0.11,3.1600114909508763e-05,2.872737719046251e-05,3.1600114909508763e-05,3.1600114909508763e-05,1.7236426314277505e-05,4.596380350474002e-05,3.1600114909508763e-05,2.872737719046251e-05,2.298190175237001e-05,2.010916403332376e-05,590,S07,2,"2: Job, Occupation, Ideas"
