,character,seid,lemmatized,polarity,subjectivity,compound,neg,neu,pos,anger,anticipation,disgust,fear,joy,negative,positive,sadness,surprise,trust,word_count,season,topic,topic_label
24069,george,S05E18,be there ever a good time to have your parent stay with you when be they leave for paris what about her place really jerry shake his head maybe this will become like a cool thing live with your parent hey believe I baldness will catch on when the alien come who do you think they re gon na relate to who do you think be go to be the first one get a tour of the ship hey by the way my parent really want to have your parent over dinner before they leave town hey alec hey joey how you doin well uh well sure joey sure I would be thrill what could I do do you see the mug on that kid ya it use to be right in the middle of single jeopardy and now they do it right after single jeopardy oh nno comparison stop jerry realize something hey hey hey hey hey hey your parent be go to paris right so I tell alec that I have to go to paris for an undetermined amount of time then all I have to do be buy some post card and have your parent mail they from paris who I m try to get out of this big brother program so when you get to paris handing morty the postcard all you have to do be drop em in any mailbox well no not yet you got ta buy french stamp pause iill reimburse you of course really my father have a ton of old clothe just sit up in the attic yyou think they re worth something what happen if the husband die after the wife who bring in the clothing in then ponder yes I suppose they do grab his jacket hey oo I just remember uh my parent really wanna have you guy over for dinner before you leave town what about tonight yea they re make paella well um what about tomorrow night ok uh I guess ill tell they that quietly ya ya no they have plan that s what I wanna know they say tomorrow maybe I do nt know what the reason could be anyway its kind of a fluke thing but uh ill be leave for paris in two day I will send you a postcard when I get there yea yaya know I feel terrible about joey but its jusit a great business opportunity ii do nt even know how long I m gon na be away for an apartment complex the uh the eiffel tower uumm like I say uh you ll be get a postcard uh in a few day and again I m sorry fantastic how gee what a coincidence I dunno they say maybe yes a cruise a long cruise just the two of you ii be nt in the attic maybe it be a mouse what you have nt even see one I guess I ve be hang on to they for so long cuz I could nt accept the fact that dad be really go forever hug a piece of clothing they will get a good home wo nt they oh I beg to differ my father take great pride in his appearance he be a very handsome man a casanova really could you make it twotwentyfive that be his higame in bowling thank you uh I m just sell some of dad thing look into kramer eye that s what he would have want leave that ll do hey that s swell dinner grab kramer you have dinner with the seinfeld be this something you have plan for a while hurriedly leave rudys they have plan they have plan aaaa look around for jerry aaaa find jerry ah ha they have plan huh they be busy they be busy with their do a little dance to make the plan seem all that important big plan mom and pop seinfeld alright I happen to know what they do last night they have dinner with kramer so what s the deal they do nt want to have dinner with my parent be there something wrong with my parent because my parent happen to be two pretty wonderful people yes so be they come tonight or not ok fine its go to be very interesting very interesting if they do nt show up tonight you know my mother make all this paella its a spanish dish its a moulage of fish an meat with rice very tasty hey could you do one other thing for I you think your parent would have any objection to take a little kid to paris with they jerry look at he confused it turn out that the kid father live in paris chuckling be that a coincidence jerry smilie eh you know alec want I to take he over there so I figure as long as they re go clap pause alright if you think its too much they do nt have to mail the postcard they be drink champaign in a buggy yea in the threshold between the living room and the kitchen the thing that bother I the most be the lying sit down vacation clap all happy ah half hug estelle the attic yyou have nt wear any of those clothe for year pick up what frank see as a mouse its the remote I m try to buy some of the clothe back realize something hey you wanna come over for dinner tonight my mother make all this extra paella apparently the seinfeld be too good for we I should nt say anything bad about your uh your partner twentyfive percent it be your idea you re do all the leg work he s rip you off if anybody should be get more its you well do nt let he take advantage of you like that I m sorry umm hehere your money back give rudy the money back iiill have the clothe so uh where be the clothe oh that s good moth well you know what happen with larvae hatch theytheyre everywhere hey uh let I take you re coat dad rudy that skunk I know he do nt burn those clothe I sell your clothe yesterday I do nt think you wear they anymore miss his plane be nt that a charter flight what happen to charter ticket when you do nt use em yes I suppose they be yes hey I get a free trip to paris I go in the big brother halloffame I mail my own postcard its alright I get lunch honesty hardwork these be the value that I be raise on the most important thing joey be to be able to look yourself in the mirror before you go to sleep at night where the hell be your father,0.14916411501777355,0.48925667828106845,0.9987,0.053,0.808,0.139,7.601042558997392e-06,2.736375321239061e-05,4.560625535398436e-06,8.361146814897132e-06,1.2161668094395828e-05,1.5962189373894523e-05,2.812385746829035e-05,1.0641459582596348e-05,1.0641459582596348e-05,1.900260639749348e-05,1147,S05,3,"3: Family, Friends, Food"
24839,george,S05E20,ow what be you do under there hey stop that do nt eat that that s not food to robin he s suckin down equal packet   kid for his birthday party to kid under table do nt put your tongue on the floor he s put his tongue on the floor here here have some more sugar packet toss some equal packet under the table how about bozo who s bozo bozo the clown that s who bozo be when I be a kid bozo the clown be the clown bar none with the orange hair and the big clown shirt with the ruffle he have a tv show he have cartoon you know when I be a kid we do nt have these elaborate birthday party wwith catered food and entertainment I remember my   birthday party nah I have asthma robin kid grab george leg from under the table and george struggle bozo bozo you ve never hear of bozo the clown how could you not know who bozo the clown be how can you call yourself a clown and not know who bozo be be he a clown what be you kid I yes he s a clown alright just forget it alright very good very good go fold your little balloon animal eric eric chuckle what kind of name be that for a clown huh well I do what I can robin come over ah great great sniff what s that smell smoke walk to the kitchen hey everybody I think I smell some smoke back here smoke boil into the doorway fire fire get out of the way because because as the leader if I die then all hope be lose who would lead the clown instead of castigate I you should all be thank I what kind of a topsyturvy world do we live in wherewhere hero be cast as villain brave man as coward seemingly seemingly to the untrained eye I can fully understand how you get that impression what look like push what look like knock down be a safety precaution in a fire you stay close to the ground be i right and when I run out that door I be not leave anyone behind oh quite the contrary I risk my life make sure that exit be clear any other question its not easy so she do nt want to see I anymore no she too and her mother yeah I may have step on her arm too I do nt know yeah but it be somebodys arm to some degree in a manner of speak yeah she should be commend I for treat everyone like equal perhaps yeah eric the clown put it out with his big shoe what s that wow he really do a number on you read seinfeld freeze like a deer in the headlight in the face of incessant heckling you know what you oughta do you should go to her office and heckle she you know like all the comedian always say how would you like it if I come to where you work and heckle you I m not kid you should do it well go ahead do it no reason this be unprecedented what be you use my baby now what accident that s unbelievable wha you run holy cow how could you do that you re batman well whawhat about the toe what happen to the toe you do all this for a pinky toe robin robin robin listen to I the most amazing thing have happen kramer have open my eye I think I ve change ok be about to explain cut to jerry onstage   you ll see thing will be different now   if you just give I one more chance alright but I m serious about this the prop comic ronnie hold up his water gun and smile oh hi I do nt recognize you what do you get a haircut,0.23167008917008913,0.55480463980464,0.9962,0.056,0.783,0.161,1.3732459643734222e-05,5.7218581848892594e-05,1.3732459643734222e-05,2.2887432739557038e-05,6.1796068396804e-05,3.204240583537985e-05,8.926098768427245e-05,1.1443716369778519e-05,5.035235202702548e-05,3.4331149109335556e-05,661,S05,0,"0: Dating, Relationships, Sex "
25112,george,S05E21,I never taste a cough medicine I do nt love you see we be make for each other thinking to himself its amazing if I reach out and touch her breast right not shed scream and throw I out of the car but at this time tomorrow I could touch it all I want potussan ever try it with club soda oh very refreshing thinking again sex be like join a private club ill be the same I tomorrow but suddenly the no trespassing sign will be go yeah about ten fifteen minute but I have to stop at a vegetable stand my mother love hampton tomato she s nuts for hampton tomato to jane you know when I be a kid I once find a dollar and fifty cent in change on the bottom of the pool yeah hey you know I get ta go get these tomato you wanna go for a ride kay ill uh ill see you later anybody want some tomato hey rachel what kind of a greeting be that yeah I love hampton tomato you know you can eat em like apple you know its funny the tomato never really take on as a hand fruit hey wow the kman they walk into the kitchen inside this be fantastic man what a weekend swimming lobster for dinner you see who what you see jane topless oh you mean face down on her chest face up on her back well why d she do that you mean she just lay there topless walk around and you look I ca nt believe that you see she before I well how good a look do you get well if she be a criminal and you have to describe she to a police sketch artist great great so anytime you want you can just visualize she naked stop it stop it its not fair its not fair I do nt like this situation jerry I do nt like it one bit yes yes the punishment should fit the crime its like I m neil armstrong I turn around for a sip of tang and you jump out first oh okay start to walk other way and then walk to their room and go in oh sorry I m sorry uh its not like I m gon na see something I ve never see before I do nt no I be just wonder   if you guy uh have any gum yes because the water be cold   and the chew warm I up okay chew thank anyway continue to chew as he exit realize he be short change I be in the pool I be in the pool do she do it on purpose I be suppose to see she she be nt suppose to see I well ordinarily I would nt mind but well I just get back from swim in the pool and the water be cold yes significant shrinkage yes I mean if she think that s I she s under a complete misapprehension that be not I jerry that be not I what if she discuss it with jane how do you know they re bad they re much bad than we they talk about everything could nt you at least tell she about the shrinkage factor how do woman know about shrinkage do woman know about shrinkage no it just do see look at this wear a very tight shirt rachel my tshirt shrink it use to be much big and now it shrink you see that s what water do it shrinks thing what re you do what re you tell secret what re you laugh at you know its very impolite to tell secret be you talk about I you re go back to new york now uh huh uh huh I think you speak to your little friend rachel that s what I think and she do nt say something to you about a certain something I think that you think that a certain something be not all that it could be when in fact it be be all that it should be and more look you do nt understand there be shrinkage well I m just express my gratitude to our gracious host a little breakfast to rachel and uh you eat egg right ah enjoy they uh good you know you might wanna try eat it with one of these hold up lobster bib not that much you know they tend to shrink in the water ah I guess I should go up and apologize I do nt know why rachel have to drive back with michael and carol hey there s a tomato stand let stop I can get some more where he look out window and get hit by a tomato,0.050161814835727875,0.5512074680552941,0.9986,0.076,0.73,0.193,1.3888353072798118e-05,1.697465375564214e-05,1.080205238995409e-05,2.3147255121330197e-05,2.3147255121330197e-05,3.54924578527063e-05,4.6294510242660393e-05,2.006095443848617e-05,9.258902048532078e-06,1.8517804097064157e-05,805,S05,3,"3: Family, Friends, Food"
25422,george,S05E22,I go to the beach jerry and elaine exchange look its not work jerry its just not work sit down next to elaine why do it all turn out like this for I I have so much promise I be personable I be bright elaine turn show disagreement oh maybe not academically speak elaine nod correct I be perceptive I always know when someone uncomfortable at a party it become very clear to I sit out there today that every decision I ve ever make in my entire life have be wrong my life be the complete opposite of everything I want it to be every instinct I have in every of aspect of life be it something to wear something to eat    its all be wrong chuckle everywhere yeah no no no wait a minute I always have tuna on toast nothing ever work out for I with tuna on toast I want the complete opposite of on toast chicken salad on rye untoasted with a side of potato salad    and a cup of tea laugh annoy good for the tuna so what what be I suppose to do elaine bald man with no job and no money who live with their parent do nt approach strange woman yeah I should do the opposite I should yes I will do the opposite I use to sit here and do nothing and regret it for the rest of the day so now I will do the opposite and I will do something excuse I uh I could nt help but notice that you be look in my direction my name be george I m unemployed and I live with my parent why shave every day it just grow right back I m afraid I m just not interested in how I present myself if those kind of superficiality be important to you this probably be nt gon na work take it easy take it easy its not the end of the world that wo nt be necessary shut your trap and stop kick the seat be try to watch the movie and if I have to tell you again be gon na take it outside and I m gon na show you what its like you understand I now shut your mouth or ill shut em for ya and if you think I m kid just try I try I because I would love it I do nt think we should we really do nt know each other very well I m the opposite of every guy you ve ever meet hey I just find twenty dollar I tell you this something be happen in my life I do this opposite thing last night up be down black be white good be day be yes yes and listen to this listen to this her uncle work for the yankee and he s gon na get I a job interview a front office kind of thing assistant to the travel secretary a job with the new york yankee this have be the dream of my life ever since I be a child and its all happen because I m completely ignore every urge towards common sense and good judgment I have have this be no long just some crazy notion elaine jerry this be my religion yes funny laugh hand clap let go alrighty ah    my last job be in publish    I uh get fire for have sex in my office with the clean woman ah alright before that I be in real estate I quit because the boss would nt let I use his private bathroom that be it of course I be different yeah well I wish I could say the same but I must say with all due respect I find it very hard to see the logic behind some of the move you have make with this fine organization in the past twenty year you have cause myself and the city of new york a good deal of distress as we have watch you take our beloved yankee and reduce they to a laugh stock all for the glorification of your massive ego the new york yankee I m the assistant to the travel secretary I m go on the road trip with em ill be on the plane   I m work in yankee stadium this be a dream I m bust jerry I m bust ya and I m move out of my parent house I m take that apartment on   street remember the one we see I m back in business baby hey to elaine who do nt look too cheerful well you could move in with my parent chuckle instinct yeah its the last one alright let go I m not gon na be nice that s how I get the job I just want the both of you to know how much you mean to I and I love you both very very much greeting people greeting greeting and salutation what a beautiful day for a ball game let play two sit down say to waitress   oh ill have the chicken salad on rye my usual you know what I get darlin turn to the gang so let see I have a little conversation today with mr don mattingly   to elaine he s the first base man we talk about his new batting stance you know I m not crazy about it but I say   donny go with it till it stop workin donny baseball he s a helluva guy,0.05468908808582721,0.48618365330321867,0.9988,0.065,0.757,0.178,9.309589226012388e-06,2.4437671718282522e-05,5.818493266257743e-06,1.2800685185767036e-05,3.1419863637791814e-05,1.7455479798773226e-05,4.6547946130061944e-05,6.982191919509292e-06,1.7455479798773226e-05,3.0256164984540264e-05,927,S05,3,"3: Family, Friends, Food"
25705,george,S06E01,ok danny take a swing tartabull swing the bat nno no no you re open up your shoulder no not really I m just say this to you because I like to hear myself talk yes really what be all sweatin for hot feel tartabull material what be this this uniform what s it make from no this be not cotton here lemme see try to look at the tag on the uniform tartabull get creep out and resist will you stop it look at the tag oh of course polyester I ca nt believe you re not play in cotton you know they use to make leisure suit out of this fabric of course alright maybe ill say something to buck hey do nt embarrass I today I get some friend in the stand george make a swinge motion with an imaginary bat and pull something in his back miss rhode island when be you see she you re incredible what if she become miss america you could be date miss america jerry chaperone what be you kid what do the chaperone do can she talk you re call she hey do you know that the yankee do nt wear cotton jersey well what be that that s a crime do you know how hot those thing get they should be wear cotton I do nt know that s all gon na change why should nt I how do you know hey buck talk to you for a second how s everything go everything ok listen buck I uh obviously I do nt need to talk to you about the importance of player morale but uh I ve be talk to some of the guy and some of they   I do nt want to mention any name   but some of they they re not too happy with the polyester uniform well they get very hot in the polyester you know its not a natural fibre I think they would prefer cotton yeah cotton breathe you see its much soft imagine playing game and your team be five degree cool than the other team do nt you think that would be an advantage they re cool they re more comfortable they re happy   they re gon na play well oh   I ve get something well do you see it the uniform do you see how they play listen to these comment read from the paper wade boggs what a fabric finally we can breathe luis palonia cotton be king paul oneill I never dream anything could be so soft and fluffy really atlantic city think yes yes I will go to atlantic city I m in i m down hey how be the show I win fifty buck boy this be great too bad elaine not here I do nt know it sound like pigeon or something I either be there anything you can do to shut they up good night stan oh go back into the bathroom that s a shame karen be show singing offkey on the television hey hey yankee game change the channel,0.1884126984126984,0.5308730158730159,0.9735,0.083,0.796,0.121,2.6087863925701766e-05,1.4907350814686723e-05,1.4907350814686723e-05,2.6087863925701766e-05,1.4907350814686723e-05,5.962940325874689e-05,7.82635917771053e-05,1.8634188518358403e-05,1.8634188518358403e-05,5.217572785140353e-05,518,S06,0,"0: Dating, Relationships, Sex "
26023,george,S06E02,hey hey elaine julie hey wanna get some lunch ah well that s very mature what about you sure all right what do you want what big salad I m go to the coffee shop I ve never see a big salad be that what I ask for the big salad no no hey ill get it what s in the big salad   well see you in a little while oh safire uh ha he can be pedantic he can be pedantic yes yes you know what s interesting the quarterback for the atlanta falcon be bobby hebert no r which I find fascinating you know its herbert herbert hebert hebert hebert its a fun name to pronounce try and say it hebert take a shot all right check arrive all right I no julie julie do nt insult I you know what difference do it make who pay for lunch its totally meaningless hey hey no you go guggenheim I m not much of a guggenheim ya you go do you see what just happen do you happen to notice that julie hand the big salad to elaine well she do nt buy the big salad I buy the big salad yes it be she just take credit for my salad that s not right I mean I m the one who buy it you think she should have say something oh I know you know you buy a big salad for somebody it would be nice if they know it yeah she s very lovely so do you enjoy your lunch oh    because she hand you the bag I could have hand you the bag she happen to pick it up at the restaurant even though        naw its just you thank she and and oh     what s the difference its just that I be the one who actually pay for the big salad she just happen to hand it to you but its no big deal no no there be no problem    just a small miscommunication whereby you thank she instead of the person actually responsible for purchase the big salad you know I think I could have play with doll if their be doll in the house it seem like fun to I it do nt seem like a gender thing I think I would like to play with doll what s so terrible a ha be just friend oh share ha ha ha uh I m not follow that well she probably just assume    uh     wait a second be you suggest that I go out of my way to tell elaine that even though you hand she the big salad that it come from I     well it be a big salad and what I would like to know be how do a person who have nothing to do with the big salad claim responsibility for that salad and accept the thank you under false pretense   ah   ah you know if it be a regular salad I would nt have say anything but you have to have the big salad,0.04360714285714285,0.37502922771672764,0.9963,0.067,0.736,0.197,1.1355205983436539e-05,4.5420823933746156e-05,7.570137322291026e-06,1.5140274644582053e-05,4.5420823933746156e-05,3.0280549289164105e-05,5.2990961256037184e-05,2.2710411966873078e-05,1.1355205983436539e-05,3.0280549289164105e-05,514,S06,3,"3: Family, Friends, Food"
26384,george,S06E03,the rule be a minimum of two day I m make it up oh well a mantel a whole different story if my parent have a mantel I might be a completely different person let have it you want I to ask one of the yankee alright ill run it by a few people who be flirt with you she be nt flirt with you really he probably do nt want to get chocolate on his finger that s the way these society type eat their candy bar what you think I eat all my meal with you to waitress excuse I sweetheart I think you may have overcharge we what be this get it the waitress walk away do you just see what happen here do you see the way she point at the check she give I the finger so what do you think channel eleven forgive I for try to class up this place for try to have the yankee reach another strata of society that might not watch channel eleven I be eat my dessert how do you eat it with your hand you want a yankee I get you a yankee hey the bull owe I one I help he with his swing absolutely pende approval of the script jerry I m yankee management hey when you order from the waitress get she to point to the menu I want to see what finger she use I do nt get the special but i d also like the fresh fruit too after waitress walk away I do nt believe it she do it again she have an itch she could have use any one of those finger that finger be mean for I oh no in and out I make sure of that and you ll be happy to know I peruse the script and its meet with my approval swerve hey watch it do you see that guy he just give I the finger oh yeah middle finger straight up at I at we I m follow he no one give we the finger be yankee no you can have it ill take care of this danny excuse I I believe you cut I off and then make an obscene gesture outside of manhattan about an hour ago that s right of the new york yankee,0.07833603896103895,0.49940386002886017,0.9631,0.055,0.814,0.131,1.3015410245730944e-05,3.904623073719283e-05,1.3015410245730944e-05,3.2538525614327364e-05,2.603082049146189e-05,3.2538525614327364e-05,6.507705122865473e-05,1.9523115368596416e-05,1.3015410245730944e-05,2.603082049146189e-05,392,S06,3,"3: Family, Friends, Food"
